{
  "schemaVersion": "2.0.0",
  "updatedAt": "2026-10-30T08:35:00+07:00",
  "layout": "monthly-weekly",
  "reports": [
    {
      "id": "daily-brief-2026-10-30",
      "date": "2026-10-30",
      "title": "Bản tin thị trường Việt Nam & thế giới",
      "status": "preopen",
      "weekId": "2026-W44",
      "weekPath": "2026-10/week-44.json",
      "dayPath": "2026-10/d/2026-10-30.json",
      "newsPath": "2026-10/n/2026-10-30.json",
      "analysisPath": "2026-10/a/2026-10-30.md",
      "path": "index.html#/2026-10-30"
    },
    {
      "id": "daily-brief-2026-10-29",
      "date": "2026-10-29",
      "title": "Bản tin thị trường Việt Nam & thế giới",
      "status": "preopen",
      "weekId": "2026-W44",
      "weekPath": "2026-10/week-44.json",
      "dayPath": "2026-10/d/2026-10-29.json",
      "newsPath": "2026-10/n/2026-10-29.json",
      "analysisPath": "2026-10/a/2026-10-29.md",
      "path": "index.html#/2026-10-29"
    },
    {
      "id": "daily-brief-2026-10-28",
      "date": "2026-10-28",
      "title": "Bản tin thị trường Việt Nam & thế giới",
      "status": "preopen",
      "weekId": "2026-W44",
      "weekPath": "2026-10/week-44.json",
      "dayPath": "2026-10/d/2026-10-28.json",
      "newsPath": "2026-10/n/2026-10-28.json",
      "analysisPath": "2026-10/a/2026-10-28.md",
      "path": "index.html#/2026-10-28"
    },
    {
      "id": "daily-brief-2026-10-27",
      "date": "2026-10-27",
      "title": "Bản tin thị trường Việt Nam & thế giới",
      "status": "preopen",
      "weekId": "2026-W44",
      "weekPath": "2026-10/week-44.json",
      "dayPath": "2026-10/d/2026-10-27.json",
      "newsPath": "2026-10/n/2026-10-27.json",
      "analysisPath": "2026-10/a/2026-10-27.md",
      "path": "index.html#/2026-10-27"
    },
    {
      "id": "daily-brief-2026-10-26",
      "date": "2026-10-26",
      "title": "Bản tin thị trường Việt Nam & thế giới",
      "status": "preopen",
      "weekId": "2026-W44",
      "weekPath": "2026-10/week-44.json",
      "dayPath": "2026-10/d/2026-10-26.json",
      "newsPath": "2026-10/n/2026-10-26.json",
      "analysisPath": "2026-10/a/2026-10-26.md",
      "path": "index.html#/2026-10-26"
    },
    {
      "id": "daily-brief-2026-10-25",
      "date": "2026-10-25",
      "title": "Bản tin thị trường Việt Nam & thế giới",
      "status": "preopen",
      "weekId": "2026-W43",
      "weekPath": "2026-10/week-43.json",
      "dayPath": "2026-10/d/2026-10-25.json",
      "newsPath": "2026-10/n/2026-10-25.json",
      "analysisPath": "2026-10/a/2026-10-25.md",
      "path": "index.html#/2026-10-25"
    },
    {
      "id": "daily-brief-2026-10-24",
      "date": "2026-10-24",
      "title": "Bản tin thị trường Việt Nam & thế giới",
      "status": "preopen",
      "weekId": "2026-W43",
      "weekPath": "2026-10/week-43.json",
      "dayPath": "2026-10/d/2026-10-24.json",
      "newsPath": "2026-10/n/2026-10-24.json",
      "analysisPath": "2026-10/a/2026-10-24.md",
      "path": "index.html#/2026-10-24"
    },
    {
      "id": "daily-brief-2026-10-23",
      "date": "2026-10-23",
      "title": "Bản tin thị trường Việt Nam & thế giới",
      "status": "preopen",
      "weekId": "2026-W43",
      "weekPath": "2026-10/week-43.json",
      "dayPath": "2026-10/d/2026-10-23.json",
      "newsPath": "2026-10/n/2026-10-23.json",
      "analysisPath": "2026-10/a/2026-10-23.md",
      "path": "index.html#/2026-10-23"
    },
    {
      "id": "daily-brief-2026-10-22",
      "date": "2026-10-22",
      "title": "Bản tin thị trường Việt Nam & thế giới",
      "status": "preopen",
      "weekId": "2026-W43",
      "weekPath": "2026-10/week-43.json",
      "dayPath": "2026-10/d/2026-10-22.json",
      "newsPath": "2026-10/n/2026-10-22.json",
      "analysisPath": "2026-10/a/2026-10-22.md",
      "path": "index.html#/2026-10-22"
    },
    {
      "id": "daily-brief-2026-10-21",
      "date": "2026-10-21",
      "title": "Bản tin thị trường Việt Nam & thế giới",
      "status": "preopen",
      "weekId": "2026-W43",
      "weekPath": "2026-10/week-43.json",
      "dayPath": "2026-10/d/2026-10-21.json",
      "newsPath": "2026-10/n/2026-10-21.json",
      "analysisPath": "2026-10/a/2026-10-21.md",
      "path": "index.html#/2026-10-21"
    },
    {
      "id": "daily-brief-2026-10-20",
      "date": "2026-10-20",
      "title": "Bản tin thị trường Việt Nam & thế giới",
      "status": "preopen",
      "weekId": "2026-W43",
      "weekPath": "2026-10/week-43.json",
      "dayPath": "2026-10/d/2026-10-20.json",
      "newsPath": "2026-10/n/2026-10-20.json",
      "analysisPath": "2026-10/a/2026-10-20.md",
      "path": "index.html#/2026-10-20"
    },
    {
      "id": "daily-brief-2026-10-19",
      "date": "2026-10-19",
      "title": "Bản tin thị trường Việt Nam & thế giới",
      "status": "preopen",
      "weekId": "2026-W43",
      "weekPath": "2026-10/week-43.json",
      "dayPath": "2026-10/d/2026-10-19.json",
      "newsPath": "2026-10/n/2026-10-19.json",
      "analysisPath": "2026-10/a/2026-10-19.md",
      "path": "index.html#/2026-10-19"
    },
    {
      "id": "daily-brief-2026-10-18",
      "date": "2026-10-18",
      "title": "Bản tin thị trường Việt Nam & thế giới",
      "status": "preopen",
      "weekId": "2026-W42",
      "weekPath": "2026-10/week-42.json",
      "dayPath": "2026-10/d/2026-10-18.json",
      "newsPath": "2026-10/n/2026-10-18.json",
      "analysisPath": "2026-10/a/2026-10-18.md",
      "path": "index.html#/2026-10-18"
    },
    {
      "id": "daily-brief-2026-10-17",
      "date": "2026-10-17",
      "title": "Bản tin thị trường Việt Nam & thế giới",
      "status": "preopen",
      "weekId": "2026-W42",
      "weekPath": "2026-10/week-42.json",
      "dayPath": "2026-10/d/2026-10-17.json",
      "newsPath": "2026-10/n/2026-10-17.json",
      "analysisPath": "2026-10/a/2026-10-17.md",
      "path": "index.html#/2026-10-17"
    },
    {
      "id": "daily-brief-2026-10-16",
      "date": "2026-10-16",
      "title": "Bản tin thị trường Việt Nam & thế giới",
      "status": "preopen",
      "weekId": "2026-W42",
      "weekPath": "2026-10/week-42.json",
      "dayPath": "2026-10/d/2026-10-16.json",
      "newsPath": "2026-10/n/2026-10-16.json",
      "analysisPath": "2026-10/a/2026-10-16.md",
      "path": "index.html#/2026-10-16"
    },
    {
      "id": "daily-brief-2026-10-15",
      "date": "2026-10-15",
      "title": "Bản tin thị trường Việt Nam & thế giới",
      "status": "preopen",
      "weekId": "2026-W42",
      "weekPath": "2026-10/week-42.json",
      "dayPath": "2026-10/d/2026-10-15.json",
      "newsPath": "2026-10/n/2026-10-15.json",
      "analysisPath": "2026-10/a/2026-10-15.md",
      "path": "index.html#/2026-10-15"
    },
    {
      "id": "daily-brief-2026-10-14",
      "date": "2026-10-14",
      "title": "Bản tin thị trường Việt Nam & thế giới",
      "status": "preopen",
      "weekId": "2026-W42",
      "weekPath": "2026-10/week-42.json",
      "dayPath": "2026-10/d/2026-10-14.json",
      "newsPath": "2026-10/n/2026-10-14.json",
      "analysisPath": "2026-10/a/2026-10-14.md",
      "path": "index.html#/2026-10-14"
    },
    {
      "id": "daily-brief-2026-10-13",
      "date": "2026-10-13",
      "title": "Bản tin thị trường Việt Nam & thế giới",
      "status": "preopen",
      "weekId": "2026-W42",
      "weekPath": "2026-10/week-42.json",
      "dayPath": "2026-10/d/2026-10-13.json",
      "newsPath": "2026-10/n/2026-10-13.json",
      "analysisPath": "2026-10/a/2026-10-13.md",
      "path": "index.html#/2026-10-13"
    },
    {
      "id": "daily-brief-2026-10-12",
      "date": "2026-10-12",
      "title": "Bản tin thị trường Việt Nam & thế giới",
      "status": "preopen",
      "weekId": "2026-W42",
      "weekPath": "2026-10/week-42.json",
      "dayPath": "2026-10/d/2026-10-12.json",
      "newsPath": "2026-10/n/2026-10-12.json",
      "analysisPath": "2026-10/a/2026-10-12.md",
      "path": "index.html#/2026-10-12"
    },
    {
      "id": "daily-brief-2026-10-11",
      "date": "2026-10-11",
      "title": "Bản tin thị trường Việt Nam & thế giới",
      "status": "preopen",
      "weekId": "2026-W41",
      "weekPath": "2026-10/week-41.json",
      "dayPath": "2026-10/d/2026-10-11.json",
      "newsPath": "2026-10/n/2026-10-11.json",
      "analysisPath": "2026-10/a/2026-10-11.md",
      "path": "index.html#/2026-10-11"
    },
    {
      "id": "daily-brief-2026-10-10",
      "date": "2026-10-10",
      "title": "Bản tin thị trường Việt Nam & thế giới",
      "status": "preopen",
      "weekId": "2026-W41",
      "weekPath": "2026-10/week-41.json",
      "dayPath": "2026-10/d/2026-10-10.json",
      "newsPath": "2026-10/n/2026-10-10.json",
      "analysisPath": "2026-10/a/2026-10-10.md",
      "path": "index.html#/2026-10-10"
    },
    {
      "id": "daily-brief-2026-10-09",
      "date": "2026-10-09",
      "title": "Bản tin thị trường Việt Nam & thế giới",
      "status": "preopen",
      "weekId": "2026-W41",
      "weekPath": "2026-10/week-41.json",
      "dayPath": "2026-10/d/2026-10-09.json",
      "newsPath": "2026-10/n/2026-10-09.json",
      "analysisPath": "2026-10/a/2026-10-09.md",
      "path": "index.html#/2026-10-09"
    },
    {
      "id": "daily-brief-2026-10-08",
      "date": "2026-10-08",
      "title": "Bản tin thị trường Việt Nam & thế giới",
      "status": "preopen",
      "weekId": "2026-W41",
      "weekPath": "2026-10/week-41.json",
      "dayPath": "2026-10/d/2026-10-08.json",
      "newsPath": "2026-10/n/2026-10-08.json",
      "analysisPath": "2026-10/a/2026-10-08.md",
      "path": "index.html#/2026-10-08"
    },
    {
      "id": "daily-brief-2026-10-07",
      "date": "2026-10-07",
      "title": "Bản tin thị trường Việt Nam & thế giới",
      "status": "preopen",
      "weekId": "2026-W41",
      "weekPath": "2026-10/week-41.json",
      "dayPath": "2026-10/d/2026-10-07.json",
      "newsPath": "2026-10/n/2026-10-07.json",